search_date,query,purpose,selected_sources
2026-03-27,intergenerational educational mobility review rank-rank slope transition matrix World Bank,global mobility measures and datasets,World Bank GDIM; van der Weide et al. 2024; Hertz et al. 2008
2026-03-27,intergenerational social mobility OECD education mobility,OECD comparative and policy framing,Causa & Johansson 2010
2026-03-27,post-socialist transition intergenerational educational mobility Kyrgyzstan transition economies,transition/post-socialist comparators,Brück & Esenaliev 2018; Verashchagina 2009/2012
2026-03-27,intergenerational education mobility Turkey development evidence,developing-country regional comparator and schooling opportunities,Aydemir & Yazici 2019; Akarçay-Gürbüz & Polat 2017
2026-03-27,Uzbekistan education sector analysis inequality tertiary access World Bank UNICEF,"Uzbekistan context on access, inequality, and reforms",World Bank 2018; UNICEF 2021; World Bank 2024 CGA; UNICEF 2023 SitAn
2026-03-27,remote learning parent support device internet challenge UNICEF World Bank pandemic,bounded Module C background,UNICEF 2020; Muñoz-Najar et al. 2021; Daniela et al. 2021; Knopik et al. 2021; Iqbal et al. 2025
